{
  "$schema": "../schema/lock.schema.json",
  "id": "draft-3p",
  "version": "0.3.0",
  "notes": "Played before S68 built coast.3p.exit: every Coast piece could leave the Coast with any legal move, so coast.3p.exit is any-legal-move here (decision 0019). Games and fairness reports of this version replay from these values.",
  "values": {
    "king.range": 2,
    "king.canJump": false,
    "king.canEnterCoast": true,
    "castling.enabled": false,
    "queen.canCrossVoid": false,
    "queen.canStandOnVoid": false,
    "queen.voidCrossings": "a5-e5-i5",
    "queen.canEnterCoast": true,
    "queen.pawnSwap": false,
    "pawn.initialDoubleStep": true,
    "pawn.promotion.targets": [
      "queen",
      "rook",
      "bishop",
      "knight"
    ],
    "pawn.safeZones": "starting-file",
    "pawn.canEnterCoast": false,
    "pawn.canEnterCenter": false,
    "center.occupants": "dragons",
    "center.passThrough": [
      "dragon-head",
      "queen",
      "king",
      "sun-moon-pawn",
      "knight"
    ],
    "coast.3p.exit": "any-legal-move",
    "coast.openToAll": false,
    "coast.returnAllowed": true,
    "coast.3p.capturable": false,
    "tail.3p.movement": "like-dragon-head",
    "tail.3p.captures": "non-coast-pieces",
    "tail.canCheck": false,
    "tail.capturable": false,
    "dragonHead.range": 8,
    "dragon.rangeMode": "squares",
    "dragon.canJump": false,
    "dragon.3p.givesCheck": false,
    "sunMoon.3p.range": 2,
    "sunMoon.capture": "any-move-square",
    "sunMoon.canPromote": false,
    "draw.3p.stalemate": "draw-between-kinged",
    "endings.3p": "stones-and-duel",
    "dragon.3p.lastKing": "checkmate",
    "tail.3p.mateTiming": "after-move",
    "draw.3p.threefoldRepetition": true,
    "draw.3p.fiftyMove": true,
    "check.3p.exposedKing": "not-allowed",
    "setup.swapKingQueen": false,
    "extendedPlay.enabled": false
  }
}
